{
  "$schema": "https://json-schema.org/draft/2020-12/schema",
  "$id": "https://github.com/zhanghao1903/my-skills/blob/main/plugins/codex-engineering-lifecycle/schemas/closure-record.schema.json",
  "title": "ClosureRecord",
  "type": "object",
  "additionalProperties": false,
  "required": ["requirementsMessageId", "mergeCommitSha", "releaseTargets", "scenariosSolved", "followUps", "closedAt", "closureId"],
  "properties": {
    "disposition": {"const": "ACCEPTED_NO_PUBLISH"},
    "acceptanceId": {"$ref": "#/$defs/digest"},
    "releaseResultId": {"$ref": "#/$defs/digest"},
    "deliveryMode": {"enum": ["AGILE", "AGILE_REVIEWED", "STRICT"]},
    "developmentAuthorityId": {"$ref": "#/$defs/digest"},
    "deliveryAuthorityId": {"$ref": "#/$defs/digest"},
    "requirementsMessageId": {"$ref": "#/$defs/digest"},
    "planReviewResultMessageId": {"$ref": "#/$defs/digest"},
    "codeReviewResultMessageId": {"$ref": "#/$defs/digest"},
    "mergeCommitSha": {"$ref": "#/$defs/sha"},
    "releaseTargets": {"type": "array", "maxItems": 20, "uniqueItems": true, "items": {"$ref": "#/$defs/digest"}},
    "scenariosSolved": {"type": "array", "minItems": 1, "maxItems": 100, "items": {"type": "string", "minLength": 1, "maxLength": 300}},
    "followUps": {"type": "array", "maxItems": 100, "items": {"type": "string", "minLength": 1, "maxLength": 300}},
    "closedAt": {"$ref": "#/$defs/timestamp"},
    "closureId": {"$ref": "#/$defs/digest"}
  },
  "allOf": [
    {
      "oneOf": [
        {
          "required": ["planReviewResultMessageId", "codeReviewResultMessageId"],
          "not": {"anyOf": [{"required": ["deliveryMode"]}, {"required": ["developmentAuthorityId"]}, {"required": ["deliveryAuthorityId"]}]}
        },
        {
          "required": ["deliveryMode", "developmentAuthorityId", "deliveryAuthorityId"],
          "not": {"anyOf": [{"required": ["planReviewResultMessageId"]}, {"required": ["codeReviewResultMessageId"]}]}
        }
      ]
    },
    {
      "oneOf": [
        {
          "required": ["releaseResultId"],
          "not": {"anyOf": [{"required": ["disposition"]}, {"required": ["acceptanceId"]}]},
          "properties": {"releaseTargets": {"minItems": 1}}
        },
        {
          "required": ["disposition", "acceptanceId"],
          "not": {"required": ["releaseResultId"]},
          "properties": {"releaseTargets": {"maxItems": 0}}
        }
      ]
    }
  ],
  "$defs": {
    "digest": {"type": "string", "pattern": "^[0-9a-f]{64}$"},
    "sha": {"type": "string", "pattern": "^[0-9a-f]{40}$"},
    "timestamp": {"type": "string", "format": "date-time", "pattern": "^\\d{4}-\\d{2}-\\d{2}T\\d{2}:\\d{2}:\\d{2}Z$"}
  }
}
